,eventid,year,imonth,iday,extended,country,country_txt,region,region_txt,city,latitude,longitude,summary,success,suicide,attacktype1,attacktype1_txt,targtype1,targtype1_txt,target1,natlty1,natlty1_txt,nperps,weaptype1,weaptype1_txt,weapdetail,nkill,nwound,spacial_distance
2207,201711210011,2017,11,21,0,147,Nigeria,11,Sub-Saharan Africa,Mubi,10.263544,13.264107000000001,"11/21/2017: A suicide bomber detonated an explosives-laden vest at the Madina mosque in Mubi, Mubi North, Adamawa, Nigeria. In addition to the assailant, at least 59 people were killed and at least 40 others were injured in the blast. No group claimed responsibility for the incident; however, sources attributed the attack to Boko Haram.",1,1,3,Bombing/Explosion,15,Religious Figures/Institutions,Mosque,147,Nigeria,1,6,Explosives,An explosives-laden vest was used in the attack.,59,40,0.9998500657870515
1871,201706090002,2017,6,9,0,95,Iraq,10,Middle East & North Africa,Musayyib,32.777344,44.289352,"06/09/2017: A female suicide bomber detonated at the Grand Al Musayyib Market in Musayyib, Babil, Iraq. In addition to the assailant, at least 31 people were killed and 23 other people were injured in the blast. The Islamic State of Iraq and the Levant (ISIL) claimed responsibility for the attack.",1,1,3,Bombing/Explosion,14,Private Citizens & Property,Market,95,Iraq,1,6,Explosives,An explosives-laden belt was used in the attack.,32,23,0.9985349578528757
2137,201710140002,2017,10,14,0,182,Somalia,11,Sub-Saharan Africa,Mogadishu,2.059819,45.326115,"10/14/2017: A suicide bomber detonated an explosives-laden truck outside the Safari Hotel at the K5 intersection in Hodan neighborhood, Mogadishu, Somalia. In addition to the assailant, at least 588 people, including three United States citizens, were killed and 316 people were injured in the blast. This was one of two coordinated suicide attacks in Mogadishu on this date; the assailants intended to target Aden Adde International Airport. Al-Shabaab claimed responsibility for the incidents.",1,1,3,Bombing/Explosion,1,Business,Hotel,182,Somalia,1,6,Explosives,An explosives-laden truck containing approximately 350 kilograms of homemade and military-grade explosives was used in the attack.,588,316,0.9938323749297444
571,201107220011,2011,7,22,0,151,Norway,8,Western Europe,Utoya,60.023268,10.24768,"07/22/2011: On Friday afternoon, in Hole, Buskerud County, Norway, in one of two related attacks, a man identified as Anders Breivik and dressed as a police officer, rode a ferry from the city to the island of Utoya, which is the location of a youth camp that is run by Norway's ruling Labor Party. He told the ferry driver that he needed to go to the island and check that everything was secure because of the bombing that just took place in the city. Once on the island, Breivik identified himself as a police officer and then opened fire on the camp attendees with his semi-automatic, 5.56 caliber Ruger Mini-14 rifle and a 9 millimeter Glock pistol. Due to the camp's location on the remote island, Breivik was able to kill 69 people and injure at least 60 others, including teenagers, before the police could reach the scene. The attack caused an unknown amount of property damage to the camp. Once the police arrived Breivik surrendered without a fight and was taken into custody. Breivik confessed to the attacks and in August 2012 he was sentenced to 21 years in prison.",1,0,2,Armed Assault,14,Private Citizens & Property,Civilians,151,Norway,1,5,Firearms,"A semi-automatic, 5.56 caliber Ruger Mini-14 rifle and a 9 millimeter Glock pistol were used in the attack.",69,60,0.9932490825420696
2115,201710050001,2017,10,5,0,153,Pakistan,6,South Asia,Fatehpur Sharif,28.571019,67.497086,"10/05/2017: A suicide bomber detonated at the Dargah Fatehpur shrine in Fatehpur Sharif, Balochistan, Pakistan. In addition to the assailant, at least 24 people were killed and more than 20 people were injured in the blast; the victims included Pakistani Police officers and civilians. The Khorasan Chapter of the Islamic State claimed responsibility for the attack.",1,1,3,Bombing/Explosion,15,Religious Figures/Institutions,Sufi Shrine,153,Pakistan,1,6,Explosives,An explosives-laden vest was used in the attack.,25,21,0.9930519597152766
